<?xml version="1.0" standalone="no"?>
<!DOCTYPE experiment SYSTEM "../../dtd/pb_experiment.dtd">

<experiment>
  <name>multi_target_TEST</name>
  <info>
    <performed_by> 
      <name>Joachim Worringen</name>
      <organization>Computer and Communications Research Lab, NEC Europe Ltd.</organization>
    </performed_by> 
    <project>perfbase test suite</project>
    <synopsis>Test processing of query object which have multiple targets.</synopsis>
    <description> A single object within a query may be referenced by more than one dependent objects
      which will work on its data. To optimize query performance, the data should only be stored once.
    </description>
  </info>
  
  <parameter>
    <name>S_msg</name>
    <synopsis>message size</synopsis>

    <datatype>integer</datatype>
    <unit>
      <base_unit>byte</base_unit>
    </unit>
  </parameter>
  
  <parameter>
    <name>MPI_version</name>
    
    <!-- datatype 'version' would be better, but requries libvnbr to be installed. -->
    <datatype>string</datatype>
    <synopsis>Version of the MPI library</synopsis>
  </parameter>
    
  <result>
    <name>T_pp</name>
    <datatype>float</datatype>
    <unit>
      <base_unit>s</base_unit>
    </unit>
    <synopsis>message latency</synopsis>
  </result>
  
</experiment>


