<?xml version="1.0" standalone="no"?>
<!DOCTYPE experiment SYSTEM "../../dtd/pb_experiment.dtd">

<experiment>
  <name>fixed_TEST</name>
  <info>
    <performed_by> 
      <name>Joachim Worringen</name>
      <organization>Computer and Communications Research Lab, NEC Europe Ltd.</organization>
    </performed_by> 
    <project>perfbase test suite</project>
    <synopsis>Test fixed values in a query.</synopsis>
    <description> Control definitions inside a query via "constants" (fixed values), defined
         either within the query or on the command line.
       </description>
  </info>

  <parameter>
    <name>S_msg</name>
    <datatype>integer</datatype>
    <unit>
      <base_unit>byte</base_unit>
    </unit>
    <synopsis>message size</synopsis>
  </parameter>

    <parameter>
      <name>MPI_version</name>

      <!-- datatype 'version' would be better, but requries libvnbr to be installed. -->
      <datatype>string</datatype>
      <synopsis>Version of the MPI library</synopsis>
    </parameter>

    <result>
      <name>T_pp</name>
      <datatype>float</datatype>
      <unit>
	<base_unit>s</base_unit>
      </unit>
      <synopsis>message latency</synopsis>
    </result>

</experiment>


