<?xml version="1.0" standalone="no"?>
<!DOCTYPE experiment SYSTEM "../../dtd/pb_experiment.dtd">

<experiment>
  <name>slice_TEST</name>
  <info>
    <performed_by> 
      <name>Joachim Worringen</name>
      <organization>Computer and Communications Research Lab, NEC Europe Ltd.</organization>
    </performed_by> 
    <project>perfbase test suite</project>
    <synopsis>Test slice operator.</synopsis>
    <description> 
      Import a number of runs with the run-order different from the order of the "performed"
      timestamps. Apply various slice operations and validate the results.
    </description>
  </info>

  <parameter>
    <name>S_msg</name>
    <datatype>integer</datatype>
    <unit>
      <base_unit>byte</base_unit>
    </unit>
    <synopsis>message size</synopsis>
  </parameter>

  <result>
    <name>T_pp</name>
    <datatype>float</datatype>
    <unit>
      <base_unit>s</base_unit>
    </unit>
    <synopsis>message latency</synopsis>
  </result>
  
</experiment>


