<?xml version="1.0" standalone="no"?>
<!DOCTYPE experiment SYSTEM "../../dtd/pb_experiment.dtd">

<experiment>
  <name>update_TEST</name>

  <info>
    <performed_by> 
      <name>Joachim Worringen</name>
      <organization>Computer and Communications Research Lab, NEC Europe Ltd.</organization>
    </performed_by> 
    <project>perfbase test suite</project>
    <synopsis>Message latency for ping-pong style communication between two processes</synopsis>
    <description>
      This is a very basic experiment as it only defines a message size and a related latency.
      It could become useful by adding parameters like interconnect, API, software version etc.
    </description>
  </info>

  <parameter>
    <name>S_msg</name>
    <synopsis>message size</synopsis>

    <datatype>integer</datatype>
    <unit>
      <base_unit>byte</base_unit>
    </unit>
  </parameter>

  <parameter occurrence="once">
    <name>MPI_version</name>
    <synopsis>MPI library version</synopsis>

    <!-- datatype 'version' would be better, but requries libvnbr to be installed. -->
    <datatype>string</datatype>
  </parameter>

  <result>
    <name>T_pp</name>
    <synopsis>message latency (halve roundtrip time)</synopsis>

    <datatype>float</datatype>
    <unit>
      <base_unit>s</base_unit>
      <scaling>micro</scaling>
    </unit>
  </result>
</experiment>


