<?xml version="1.0" standalone="no"?>
<!DOCTYPE experiment SYSTEM "../../dtd/pb_experiment.dtd">

<experiment>
  <name>barchart_TEST</name>

  <info>
    <performed_by> 
      <name>Joachim Worringen</name>
      <organization>Computer and Communications Research Lab, NEC Europe Ltd.</organization>
    </performed_by> 
    <project>perfbase testsuite</project>
    <synopsis>Test for correct creation of barcharts</synopsis>
    <description>
          Because of the artifical creation of x-index values for the data sets to 
          be plotted, correctnes of barcharts is sensitive to non-matching "x-data"
          when muliple data sets are to be plotted into a single chart. This experiment
          tests the behaviour of perfbase for these cases.
       </description>
  </info>

  <parameter occurrence="once">
    <name>MPI_version</name>
    <synopsis>Version of the MPI library</synopsis>

    <datatype>version</datatype>
  </parameter>

  <parameter>
    <name>S_msg</name>
    <synopsis>message size</synopsis>

    <datatype>integer</datatype>
    <unit>
      <base_unit>byte</base_unit>
    </unit>
  </parameter>

  <result>
    <name>T_pp</name>
    <synopsis>halve of roundtrip latency</synopsis>

    <datatype>float</datatype>
    <unit>
      <base_unit>s</base_unit>
      <scaling>micro</scaling>
    </unit>
  </result>
</experiment>


