<?xml version="1.0" standalone="no"?>
<!DOCTYPE experiment SYSTEM "../../dtd/pb_experiment.dtd">

<experiment>
  <name>missing_TEST</name>
  <info>
    <performed_by> 
      <name>Joachim Worringen</name>
      <organization>Computer and Communications Research Lab, NEC Europe Ltd.</organization>
    </performed_by> 
    <project>perfbase test suite</project>
    <synopsis>Test behaviour for missing values in a query.</synopsis>
    <description> 
      perfbase supports different actions that are to be perfomed if a content
      for a value is not found in the input files.
    </description>
  </info>
  
  <parameter>
    <name>S_msg</name>
    <synopsis>message size</synopsis>

    <datatype>integer</datatype>
    <unit>
      <base_unit>byte</base_unit>
    </unit>
  </parameter>
  
  <parameter occurrence="once">
    <name>MPI_version</name>
    <synopsis>Version of the MPI library</synopsis>

    <!-- datatype 'version' would be better, but requries libvnbr to be installed. -->
    <datatype>string</datatype>
  </parameter>

  <parameter occurrence="once">
    <name>OS_version</name>
    <synopsis>Version of the OS</synopsis>

    <!-- datatype 'version' would be better, but requries libvnbr to be installed. -->
    <datatype>string</datatype>
    <default>1.0</default>
  </parameter>

  <result>
    <name>T_pp</name>
    <synopsis>message latency</synopsis>
    
    <datatype>float</datatype>
    <unit>
	<base_unit>s</base_unit>
    </unit>
    <default></default>
  </result>

</experiment>


